{
  "version": 3,
  "name": "Example Stool",
  "created": "2026-04-25T00:00:00.000Z",
  "pieces": [
    {
      "type": "Board",
      "id": 1,
      "label": "Seat",
      "notches": 0,
      "csgModified": false,
      "price": 0.012,
      "priceMode": "per_mm",
      "sourceId": null,
      "sourcePrice": 0,
      "sourcePriceMode": null,
      "sourceLabel": null,
      "groupId": null,
      "px": 0,
      "py": 450,
      "pz": 0,
      "rx": 0,
      "ry": 0,
      "rz": 0,
      "w": 320,
      "h": 20,
      "d": 320
    },
    {
      "type": "Tapered Leg",
      "id": 2,
      "label": "Leg FL",
      "notches": 0,
      "csgModified": false,
      "price": 0.018,
      "priceMode": "per_mm",
      "sourceId": null,
      "sourcePrice": 0,
      "sourcePriceMode": null,
      "sourceLabel": null,
      "groupId": "grp_1",
      "px": -130,
      "py": 220,
      "pz": 130,
      "rx": 0,
      "ry": 0,
      "rz": 0,
      "rTop": 20,
      "rBottom": 15,
      "h": 440
    },
    {
      "type": "Tapered Leg",
      "id": 3,
      "label": "Leg FR",
      "notches": 0,
      "csgModified": false,
      "price": 0.018,
      "priceMode": "per_mm",
      "sourceId": null,
      "sourcePrice": 0,
      "sourcePriceMode": null,
      "sourceLabel": null,
      "groupId": null,
      "px": 130,
      "py": 220,
      "pz": 130,
      "rx": 0,
      "ry": 0,
      "rz": 0,
      "rTop": 20,
      "rBottom": 15,
      "h": 440
    },
    {
      "type": "Tapered Leg",
      "id": 4,
      "label": "Leg BL",
      "notches": 0,
      "csgModified": false,
      "price": 0.018,
      "priceMode": "per_mm",
      "sourceId": null,
      "sourcePrice": 0,
      "sourcePriceMode": null,
      "sourceLabel": null,
      "groupId": null,
      "px": -130,
      "py": 220,
      "pz": -130,
      "rx": 0,
      "ry": 0,
      "rz": 0,
      "rTop": 20,
      "rBottom": 15,
      "h": 440
    },
    {
      "type": "Tapered Leg",
      "id": 5,
      "label": "Leg BR",
      "notches": 0,
      "csgModified": false,
      "price": 0.018,
      "priceMode": "per_mm",
      "sourceId": null,
      "sourcePrice": 0,
      "sourcePriceMode": null,
      "sourceLabel": null,
      "groupId": null,
      "px": 130,
      "py": 220,
      "pz": -130,
      "rx": 0,
      "ry": 0,
      "rz": 0,
      "rTop": 20,
      "rBottom": 15,
      "h": 440
    },
    {
      "type": "Board",
      "id": 6,
      "label": "Apron Front",
      "notches": 0,
      "csgModified": false,
      "price": 0,
      "priceMode": "fixed",
      "sourceId": "src1",
      "sourcePrice": 8.0,
      "sourcePriceMode": "fixed",
      "sourceLabel": "Apron Stock",
      "groupId": null,
      "px": 0,
      "py": 410,
      "pz": 131,
      "rx": 0,
      "ry": 0,
      "rz": 0,
      "w": 240,
      "h": 60,
      "d": 18
    },
    {
      "type": "Board",
      "id": 7,
      "label": "Apron Back",
      "notches": 0,
      "csgModified": false,
      "price": 0,
      "priceMode": "fixed",
      "sourceId": "src1",
      "sourcePrice": 8.0,
      "sourcePriceMode": "fixed",
      "sourceLabel": "Apron Stock",
      "groupId": null,
      "px": 0,
      "py": 410,
      "pz": -131,
      "rx": 0,
      "ry": 0,
      "rz": 0,
      "w": 240,
      "h": 60,
      "d": 18
    },
    {
      "type": "Board",
      "id": 8,
      "label": "Apron Left",
      "notches": 0,
      "csgModified": false,
      "price": 0,
      "priceMode": "fixed",
      "sourceId": "src1",
      "sourcePrice": 8.0,
      "sourcePriceMode": "fixed",
      "sourceLabel": "Apron Stock",
      "groupId": null,
      "px": -131,
      "py": 410,
      "pz": 0,
      "rx": 0,
      "ry": 0,
      "rz": 0,
      "w": 18,
      "h": 60,
      "d": 240
    },
    {
      "type": "Board",
      "id": 9,
      "label": "Apron Right",
      "notches": 0,
      "csgModified": false,
      "price": 0,
      "priceMode": "fixed",
      "sourceId": "src1",
      "sourcePrice": 8.0,
      "sourcePriceMode": "fixed",
      "sourceLabel": "Apron Stock",
      "groupId": null,
      "px": 131,
      "py": 410,
      "pz": 0,
      "rx": 0,
      "ry": 0,
      "rz": 0,
      "w": 18,
      "h": 60,
      "d": 240
    },
    {
      "type": "Dowel",
      "id": 10,
      "label": "Seat Dowel FL",
      "notches": 0,
      "csgModified": false,
      "price": 0.1,
      "priceMode": "fixed",
      "sourceId": null,
      "sourcePrice": 0,
      "sourcePriceMode": null,
      "sourceLabel": null,
      "groupId": "grp_1",
      "px": -130,
      "py": 440,
      "pz": 130,
      "rx": 0,
      "ry": 0,
      "rz": 0,
      "r": 5,
      "h": 30
    },
    {
      "type": "Dowel",
      "id": 11,
      "label": "Seat Dowel FR",
      "notches": 0,
      "csgModified": false,
      "price": 0.1,
      "priceMode": "fixed",
      "sourceId": null,
      "sourcePrice": 0,
      "sourcePriceMode": null,
      "sourceLabel": null,
      "groupId": null,
      "px": 130,
      "py": 440,
      "pz": 130,
      "rx": 0,
      "ry": 0,
      "rz": 0,
      "r": 5,
      "h": 30
    },
    {
      "type": "Dowel",
      "id": 12,
      "label": "Seat Dowel BL",
      "notches": 0,
      "csgModified": false,
      "price": 0.1,
      "priceMode": "fixed",
      "sourceId": null,
      "sourcePrice": 0,
      "sourcePriceMode": null,
      "sourceLabel": null,
      "groupId": null,
      "px": -130,
      "py": 440,
      "pz": -130,
      "rx": 0,
      "ry": 0,
      "rz": 0,
      "r": 5,
      "h": 30
    },
    {
      "type": "Dowel",
      "id": 13,
      "label": "Seat Dowel BR",
      "notches": 0,
      "csgModified": false,
      "price": 0.1,
      "priceMode": "fixed",
      "sourceId": null,
      "sourcePrice": 0,
      "sourcePriceMode": null,
      "sourceLabel": null,
      "groupId": null,
      "px": 130,
      "py": 440,
      "pz": -130,
      "rx": 0,
      "ry": 0,
      "rz": 0,
      "r": 5,
      "h": 30
    },
    {
      "type": "Dowel",
      "id": 14,
      "label": "Apron Dowel F-L",
      "notches": 0,
      "csgModified": false,
      "price": 0.08,
      "priceMode": "fixed",
      "sourceId": null,
      "sourcePrice": 0,
      "sourcePriceMode": null,
      "sourceLabel": null,
      "groupId": null,
      "px": -116,
      "py": 405,
      "pz": 131,
      "rx": 0,
      "ry": 0,
      "rz": 1.5707963267948966,
      "r": 4,
      "h": 30
    },
    {
      "type": "Dowel",
      "id": 15,
      "label": "Apron Dowel F-R",
      "notches": 0,
      "csgModified": false,
      "price": 0.08,
      "priceMode": "fixed",
      "sourceId": null,
      "sourcePrice": 0,
      "sourcePriceMode": null,
      "sourceLabel": null,
      "groupId": null,
      "px": 116,
      "py": 405,
      "pz": 131,
      "rx": 0,
      "ry": 0,
      "rz": 1.5707963267948966,
      "r": 4,
      "h": 30
    },
    {
      "type": "Dowel",
      "id": 16,
      "label": "Apron Dowel B-L",
      "notches": 0,
      "csgModified": false,
      "price": 0.08,
      "priceMode": "fixed",
      "sourceId": null,
      "sourcePrice": 0,
      "sourcePriceMode": null,
      "sourceLabel": null,
      "groupId": null,
      "px": -116,
      "py": 405,
      "pz": -131,
      "rx": 0,
      "ry": 0,
      "rz": 1.5707963267948966,
      "r": 4,
      "h": 30
    },
    {
      "type": "Dowel",
      "id": 17,
      "label": "Apron Dowel B-R",
      "notches": 0,
      "csgModified": false,
      "price": 0.08,
      "priceMode": "fixed",
      "sourceId": null,
      "sourcePrice": 0,
      "sourcePriceMode": null,
      "sourceLabel": null,
      "groupId": null,
      "px": 116,
      "py": 405,
      "pz": -131,
      "rx": 0,
      "ry": 0,
      "rz": 1.5707963267948966,
      "r": 4,
      "h": 30
    },
    {
      "type": "Dowel",
      "id": 18,
      "label": "Apron Dowel L-F",
      "notches": 0,
      "csgModified": false,
      "price": 0.08,
      "priceMode": "fixed",
      "sourceId": null,
      "sourcePrice": 0,
      "sourcePriceMode": null,
      "sourceLabel": null,
      "groupId": null,
      "px": -131,
      "py": 390,
      "pz": 116,
      "rx": 1.5707963267948966,
      "ry": 0,
      "rz": 0,
      "r": 4,
      "h": 30
    },
    {
      "type": "Dowel",
      "id": 19,
      "label": "Apron Dowel L-B",
      "notches": 0,
      "csgModified": false,
      "price": 0.08,
      "priceMode": "fixed",
      "sourceId": null,
      "sourcePrice": 0,
      "sourcePriceMode": null,
      "sourceLabel": null,
      "groupId": null,
      "px": -131,
      "py": 390,
      "pz": -116,
      "rx": 1.5707963267948966,
      "ry": 0,
      "rz": 0,
      "r": 4,
      "h": 30
    },
    {
      "type": "Dowel",
      "id": 20,
      "label": "Apron Dowel R-F",
      "notches": 0,
      "csgModified": false,
      "price": 0.08,
      "priceMode": "fixed",
      "sourceId": null,
      "sourcePrice": 0,
      "sourcePriceMode": null,
      "sourceLabel": null,
      "groupId": null,
      "px": 131,
      "py": 390,
      "pz": 116,
      "rx": 1.5707963267948966,
      "ry": 0,
      "rz": 0,
      "r": 4,
      "h": 30
    },
    {
      "type": "Dowel",
      "id": 21,
      "label": "Apron Dowel R-B",
      "notches": 0,
      "csgModified": false,
      "price": 0.08,
      "priceMode": "fixed",
      "sourceId": null,
      "sourcePrice": 0,
      "sourcePriceMode": null,
      "sourceLabel": null,
      "groupId": null,
      "px": 131,
      "py": 390,
      "pz": -116,
      "rx": 1.5707963267948966,
      "ry": 0,
      "rz": 0,
      "r": 4,
      "h": 30
    }
  ],
  "groups": [
    {
      "gId": "grp_1",
      "px": 0,
      "py": 0,
      "pz": 0,
      "rx": 0,
      "ry": 0,
      "rz": 0
    }
  ],
  "rulers": [
    {
      "p1": [180, 0, 180],
      "p2": [180, 460, 180]
    }
  ]
}
